"Title","Body","Status","Type","Repository","Area","Priority","Class of Service","PBS ID","Requirement ID","Feature ID","WBS ID","Test ID","Size","Cycle","Dependencies","Milestone"
"E-PLT-01 | Pilotage global InstantRelease","Objective: Pilotage global InstantRelease | Epic ID: E-PLT-01 | Repository: instant-release_ACTIONS | Scope In: gouvernance delivery multi-repo | Scope Out: implementation detaillee des features | PBS ID: S3 | WBS ID: W1/W6 | Dependencies: {{DEPENDENCIES_NONE}} | Milestone: ACTIONS-M0-RESET-BOARD","Backlog Qualifie","Epic","instant-release_ACTIONS","DevOps","P1","Standard","S3","","","W1/W6","","L","{{CYCLE_01}}","{{DEPENDENCIES_NONE}}","ACTIONS-M0-RESET-BOARD"
"E-ACT-01 | Industrialisation ACTIONS","Objective: Industrialisation ACTIONS | Epic ID: E-ACT-01 | Repository: instant-release_ACTIONS | Scope In: contrat action, versioning, changelog, release, quality gates | PBS ID: S1 | WBS ID: W2 | Dependencies: {{DEPENDENCIES_NONE}} | Milestone: ACTIONS-M2-VERSIONING-CHANGELOG-RELEASE","Backlog Qualifie","Epic","instant-release_ACTIONS","DevOps","P1","Standard","S1","","","W2","","L","{{CYCLE_03}}","{{DEPENDENCIES_NONE}}","ACTIONS-M2-VERSIONING-CHANGELOG-RELEASE"
"E-API-01 | Socle API de pilotage","Objective: Socle API de pilotage | Epic ID: E-API-01 | Repository: instant-release_API | Scope In: contrats API, services, controllers, securite | PBS ID: S2.C3 | WBS ID: W3 | Dependencies: {{DEPENDENCIES_NONE}} | Milestone: API-M1-CONTRATS-ENDPOINTS","Backlog Qualifie","Epic","instant-release_API","API","P1","Standard","S2.C3","","","W3","","L","{{CYCLE_02}}","{{DEPENDENCIES_NONE}}","API-M1-CONTRATS-ENDPOINTS"
"E-APP-01 | Application web de pilotage","Objective: Application web de pilotage | Epic ID: E-APP-01 | Repository: instant-release_APP | Scope In: dashboard, configuration, journal execution | PBS ID: S2.C2 | WBS ID: W4 | Dependencies: {{DEPENDENCIES_NONE}} | Milestone: APP-M1-DASHBOARD","Backlog Qualifie","Epic","instant-release_APP","Web","P1","Standard","S2.C2","","","W4","","L","{{CYCLE_02}}","{{DEPENDENCIES_NONE}}","APP-M1-DASHBOARD"
"E-VIT-01 | Site vitrine et acquisition","Objective: Site vitrine et acquisition | Epic ID: E-VIT-01 | Repository: instant-release_VITRINE | Scope In: pages, SEO, analytics conversion | PBS ID: S2.C1/S5 | WBS ID: W5 | Dependencies: {{DEPENDENCIES_NONE}} | Milestone: VITRINE-M1-PAGES-CORE","Backlog Qualifie","Epic","instant-release_VITRINE","Web","P1","Standard","S2.C1/S5","","","W5","","L","{{CYCLE_02}}","{{DEPENDENCIES_NONE}}","VITRINE-M1-PAGES-CORE"
"E-X-01 | Integration et readiness cross-repo","Objective: Integration et readiness cross-repo | Epic ID: E-X-01 | Repository: instant-release_ACTIONS | Scope In: compatibilite versions, e2e cross-repo, package de preuves | PBS ID: S2.C4/S3.C2 | WBS ID: W6 | Dependencies: E-ACT-01,E-API-01,E-APP-01,E-VIT-01 | Milestone: ACTIONS-M5-RELEASE-HARDENING","Backlog Qualifie","Epic","instant-release_ACTIONS","DevOps","P0","Standard","S2.C4/S3.C2","","","W6","","L","{{CYCLE_06}}","E-ACT-01,E-API-01,E-APP-01,E-VIT-01","ACTIONS-M5-RELEASE-HARDENING"
"E-DOC-01 | Gouvernance documentaire","Objective: Gouvernance documentaire | Epic ID: E-DOC-01 | Repository: instant-release_ACTIONS | Scope In: maintenance PBS/WBS/OBS/PAQ/SFD/traceabilite | PBS ID: S3.C2.SC6 | WBS ID: W1 | Dependencies: E-PLT-01 | Milestone: ACTIONS-M0-RESET-BOARD","Backlog Qualifie","Epic","instant-release_ACTIONS","Docs","P1","Standard","S3.C2.SC6","","","W1","","M","{{CYCLE_01}}","E-PLT-01","ACTIONS-M0-RESET-BOARD"
